title,type,description,disciplines,organization,keywords,program_work_experience_required,url
RSE Personal Research Fellowships,Type: Professional Fellowships,"RSE Personal Research Fellowships allow eligible applicants to take up to twelve months to focus on a research project of their choice. The award provides funding for the appointment of a temporary replacement to enable the awardee to take research leave, either in their own institution or elsewhere, while remaining in continuous employment with their present employer. In addition to funding the salary, this grant funds research costs for the awardee. Fellowships are open to early and mid-career researchers. Applicants must be existing members of academic staff on open-ended or continuing contracts in a Higher Education Institution (HEI), Research Institution (RI), or Cultural Institution (CI) in Scotland.","Disciplines: Education, Social Sciences / Liberal Arts, Medicine / Health Sciences, Science, Business, Creative Arts, Communications, Engineering, Public Service, Technology, Law, International Affairs",The Royal Society of Edinburgh,"Keywords: Early Career, Early Career Researchers, Higher Education, Mid Career researchers, Mid-Career, Research Fellowship, Research Funding, Research Projects, Researchers, Scotland","Work Experience: 0-5, 5-10",https://www.profellow.com/fellowship/rse-personal-research-fellowships/
Google Public Policy Fellowship,"Type: Masters Fellowships, Undergraduate Fellowships","The Google Public Policy Fellowship program is held in markets across the United States, Europe, and Emerging Markets. It offers undergraduate, graduate, and law students interested in internet and technology policy the opportunity to spend a semester contributing to the public dialogue on these issues and exploring future academic and professional interests. Fellows will have the opportunity to work at public interest organizations at the forefront of debates on tech policy issues or public affairs consultancies with expertise in the policy strategy space.","Disciplines: Public Service, Technology, Law, International Affairs",Google Policy Fellowship,"Keywords: Graduate Students, Internet Policy, Internet Policy Fellowship, Law Student, Public Affairs, Public Interest Law, Public Policy, Public Service, Technologist, Undergraduate Students","Work Experience: 0-5, 5-10",https://www.profellow.com/fellowship/google-public-policy-fellowship/
Digital Research Visiting Fellowships,Type: Post-doctoral Fellowships,"These Digital Research Visiting Fellowships of between two and four months are intended to encourage outstanding, digitally-focussed, interdisciplinary research, international scholarly collaboration, and networking activities of Visiting Research Fellows with a specific focus on the digital. Fellows will be expected to give two presentations about their research during their stay, one of which will be organized by CDCS. A bursary of up to £2,600 will be offered to successful candidates to contribute towards travel and subsistence costs.",Disciplines: Technology,University of Edinburgh (IASH),"Keywords: Data and Digital Services, Digital, Digital Media, Doctorate, Edinburgh, Interdisciplinary Research, International Scholars, Visiting Fellowship, Visiting Researchers","Work Experience: 0-5, 5-10, 10+",https://www.profellow.com/fellowship/digital-research-visiting-fellowships/
Georg Forster Research Fellowship for Sustainable Development,Type: Post-doctoral Fellowships,"The Alexander von Humboldt Foundation grants the Georg Forster Research Fellowship to postdoctoral and experienced researchers who are contributing to sustainable development. Researchers in all disciplines from developing and emerging countries can apply who have above-average qualifications. The Fellowship enables them to conduct their own research at various stages of their career in collaboration with a host at a German research institution of their choice. Fellowships may last from 6 to 24 months and can be divided into up to three stays within three years. Applications are reviewed for this program meets every February, June, and October.","Disciplines: Education, Social Sciences / Liberal Arts, Medicine / Health Sciences, Science, Business, Creative Arts, Communications, Engineering, Public Service, Technology, Law, International Affairs",Alexander von Humboldt Foundation,"Keywords: Experienced Researcher, Germany, Postdoctoral Research, Postdoctoral Researchers, Research Fellowships, Research in Germany, Researchers, sustainable development","Work Experience: 0-5, 5-10, 10+",https://www.profellow.com/fellowship/georg-forster-research-fellowship-for-sustainable-development/
W.E.B. Du Bois Fellowship in Support of Diversity and Inclusion,"Type: Doctoral Fellowships, Masters Fellowships, Summer Fellowships","The W.E.B. Du Bois Fellowship is open to graduate students currently enrolled in a U.S. college or university and is focused on students who identify as a member of a racial or ethnic minority group that has been underrepresented in the field of polling research. Fellowship efforts are primarily focused on the development of introductory-level instructional materials in public opinion survey research for use by educators. W.E.B. Du Bois Fellows receive a $5,000 stipend for the summer, as well as complimentary AAPOR membership. The entire Fellowship program is conducted online; Ithaca residence is not required.","Disciplines: Education, Social Sciences / Liberal Arts, Public Service, Technology","Roper Center, Cornell University","Keywords: Educator, Graduate Students, Ithaca, Minority, Online Fellowship, Opinion Polling, Public Policy, Racial and Ethnic Groups, Racial Minorities, Survey Research, Virtual",Work Experience: Any,https://www.profellow.com/fellowship/w-e-b-du-bois-fellowship-in-support-of-diversity-and-inclusion/
ShareTheMicInCyber Fellowship Program,Type: Professional Fellowships,"#ShareTheMicInCyber (#STMIC) is a movement that seeks to enhance diversity and address the challenges raised by systemic racism in the field of cybersecurity. The #STMIC Fellowship, hosted in partnership between #ShareTheMicInCyber and New America, provides a platform to raise up under-represented mid-career cybersecurity professionals or those transitioning into cybersecurity. It aims to support new independent research and enhance projects while also providing opportunities for professional development to further Fellows’ careers in cybersecurity. Within the Fellowship are two tracks, Research and Impact: Applicants are individuals who work within cybersecurity or are looking to transition into cybersecurity.",Disciplines: Technology,New America,"Keywords: Anti-Black Racism, Black Communities, Cyber Security, Cybersecurity, Racism, ShareTheMicInCyber",Work Experience: Any,https://www.profellow.com/fellowship/sharethemicincyber-fellowship-program/
FAS International Agricultural Fellowship,Type: Masters Fellowships,"The USDA’s Foreign Agricultural Service (FAS) is now seeking applicants for the 2024 FAS International Agricultural Fellowship Program (IAFP). The IAFP encourages the application of individuals interested in promoting U.S. agriculture in foreign markets and advancing international food security through careers as Foreign Service Officers in the Foreign Agricultural Service, a uniquely rewarding public service career. The program encourages the application of members of minority groups historically underrepresented in USDA and those with financial need. It is open to U.S. students and alumni of any accredited university and with any undergraduate major.","Disciplines: Medicine / Health Sciences, Science, Business, Engineering, Public Service, International Affairs",U.S. Department of Agriculture (USDA),"Keywords: Agribusiness, Agricultural Economics, Agricultural Service, Farming, Federal Government, Foreign Service, Full Funding, Graduate Fellowships, Masters Funding, Minority, Underrepresented, USDA",Work Experience: Any,https://www.profellow.com/fellowship/foreign-agricultural-service-diversity-fellowship-program/
GAANN Fellowship in Cyber-Security of Power Systems,Type: Doctoral Fellowships,"The Graduate Assistance in Areas of National Need (GAANN) Fellowship in Cyber-Security of Power Systems is available for NC State graduate students who intend to become university teachers and/or researchers. Fellows must pursue an interdisciplinary course of study, combining a major in one of the participating departments with a minor and research project in power systems. The Fellowship is awarded based on academic performance and financial need, upon the recommendation of the student’s department and approval by the Graduate School and the Fellowship Program Selections Committee.","Disciplines: Engineering, Technology",NC State University,"Keywords: Computer Engineering, Computer Science, Cybersecurity, Information Technology, North Carolina, North Carolina State University",Work Experience: Any,https://www.profellow.com/fellowship/gaann-fellowship-in-cyber-security-of-power-systems/
Nancy and Frank Kudla Endowed Fellowship In Cybersecurity,Type: Masters Fellowships,"The Kudla Fellows program is a prestigious and competitive graduate fellowship program. The program supports graduate student research and education in cyber security. To qualify for a Kudla Fellowship, you must be a UTSA Master of Science in Information Technology (MSIT), Cyber Security concentration student. Fellows get access to state-of-the-art cyber security research laboratories and collaborate with world-class cyber security researchers during a paid graduate research assistantship. Receive up to $12,000 per year toward your program tuition and fees.",Disciplines: Technology,University of Texas at San Antonio,"Keywords: Computer Engineering, Computer Science, Cyber Security, Cybersecurity, Information Technology, Kudla Fellowship, Masters Funding, University of Texas",Work Experience: Any,https://www.profellow.com/fellowship/nancy-and-frank-kudla-endowed-fellowship-in-cybersecurity/
CISA Cyber Innovation Fellows Initiative,Type: Professional Fellowships,"The CISA Cyber Innovation Fellows initiative offers senior technical experts from across the private sector the opportunity to embed in CISA’s cybersecurity teams for their professional development benefit and to the benefit of CISA’s growing mission space. Participants will help to innovate the agency’s approach to cybersecurity, while also gaining awareness of CISA’s mission which will enhance the participant’s own skills and knowledge. If accepted, Fellows will be assigned a position, based on background and qualifications, and serve on a part-time basis of one to two days per week for a period of up to four months. Fellows will be compensated solely by their private sector employer.",Disciplines: Technology,Cybersecurity and Infrastructure Security Agency,"Keywords: Artificial Intelligence, Cloud Engineering, Cloud Security, Cyber Risk Evaluation, Cyber Security, Cybersecurity, Federal Cybersecurity, Machine Learning, Machine Learning Expert, Mid-Career, Remediation and Mitigation, Short-term, Technical Experts, Threat Intelligence","Work Experience: 5-10, 10+",https://www.profellow.com/fellowship/cisa-cyber-innovation-fellows-initiative/
NYU Cyber Fellows Program,Type: Masters Fellowships,"The NYU Cyber Fellows program is a master’s degree initiative designed to respond to concerns over the growing shortfall in the number of cybersecurity professionals.  NYU Cyber Fellows receive scholarships that cover roughly 75% of tuition for US residents, and as a part-time program, that offers much of the course work online, it is also an accessible program for those currently working full-time. Among the many advantages of the NYU Cyber Fellows program is that the students are given access to NYC3’s Cyber Range — a virtual training network designed to prepare students to respond to real-life threats in real time.",Disciplines: Technology,NYU Center for Cyber Security,"Keywords: Computer Engineering, Computer Science, Cybersecurity, Information Technology, Masters Funding, New York City, NYU",Work Experience: Any,https://www.profellow.com/fellowship/nyu-cyber-fellows-program/
Curtis B. Smith Cybersecurity Fellowship,"Type: Doctoral Fellowships, Masters Fellowships, Undergraduate Fellowships","The Curtis B. Smith Cybersecurity Fellowship supports high-achieving students enrolled in any degree program at the UC Berkeley School of Information who have an interest in the field of cybersecurity or a research focus on cybersecurity. The Smith Fellowship is awarded annually in the fall semester. A total of $3,000 may be awarded each year: either a single award of $3,000 or multiple smaller awards totaling up to $3,000, at the discretion of the fellowship committee. The Smith Fellowship is open to all current UC Berkeley School of Information graduate students; students in the MICS, MIDS, 5th Year MIDS, MIMS, and Ph.D. programs are all eligible to apply.",Disciplines: Technology,UC Berkeley School of Information,"Keywords: California, Computer Engineering, Computer Science, Cyber Security, Cybersecurity, Cybersecurity Policy, Information Technology, Technology Policy, UC Berkeley",Work Experience: Any,https://www.profellow.com/fellowship/curtis-b-smith-cybersecurity-fellowship/
The Julian Chin PhD Fellowship in Cybersecurity,Type: Doctoral Fellowships,"The Julian Chin PhD Fellowship in Cybersecurity will enable students to follow in the footsteps of Julian Chin, renowned for solving the most challenging technical problems facing the national security community. The Julian Chin Ph.D. Fellowship in Cybersecurity is open to U.S. citizens who plan full-time, uninterrupted study toward a Ph.D. at Virginia Tech and under the supervision of faculty at the Virginia Tech National Security Institute. The fellowship includes a yearly stipend of $38,000 and up to four years of total support, depending on renewal.",Disciplines: Technology,Virginia Tech,"Keywords: Cyber Security, Cybersecurity, Doctoral Fellowship, Ph.D., PhD Fellowship, Virginia Tech",Work Experience: Any,https://www.profellow.com/fellowship/the-julian-chin-phd-fellowship-in-cybersecurity/
CISAC Fellowship Programs,"Type: Doctoral Fellowships, Post-doctoral Fellowships","CISAC offers a rich variety of fellowships for scholars who want to spend an academic year researching an international security issue. CISAC fellows (predoctoral, postdoctoral, and junior faculty) may focus on a variety of security topics, including nuclear weapons policy and nonproliferation; nuclear energy; digital security (cyber, artificial intelligence, and autonomous systems); biosecurity and global health; insurgency, terrorism and civil conflict; national security strategies; and global governance. Applicants are welcome from the U.S. and abroad. There are many fellowship opportunities by research area. Applicants will be considered for all fellowships for which they are deemed eligible.",Disciplines: Technology,Center for International Security and Cooperation (CISAC),"Keywords: Biotechnology Innovation, Cyber Policy, Cyber Security, Cybersecurity, Cybersecurity Policy, Doctoral Research, International Security, National Security, Postdoctoral Research, Security Fellowship, Security Studies",Work Experience: Any,https://www.profellow.com/fellowship/cisac-fellowship-programs/
Intelligence and Cybersecurity Diversity Fellowship Program,"Type: Masters Fellowships, Undergraduate Fellowships, Professional Fellowships","The Intelligence and Cybersecurity Diversity Fellowship Program is designed to help DHS recruit, retain, and reward the best and brightest in the fields of intelligence or cybersecurity. The program provides qualified students opportunities to work alongside highly skilled intelligence or cybersecurity professionals at DHS, gain hands-on technical experience, interact with experts and peers at professional development events and expand their professional network at national conferences. During the 12-week program, participants will be immersed in a federal work environment by collaborating with subject matter expert mentors on projects and performing assigned tasks on the intelligence and cybersecurity track.",Disciplines: Technology,U.S. Department of Homeland Security,"Keywords: Cybersecurity, Cybersecurity Professional, HBCU, Homeland Security, Intelligence and Cybersecurity",Work Experience: Any,https://www.profellow.com/fellowship/intelligence-and-cybersecurity-diversity-fellowship-program/
Cybersecurity Student Fellows Program,Type: Masters Fellowships,"To promote the interdisciplinary study of cybersecurity issues the Strauss Center established the Cybersecurity Student Fellows Program to encourage full-time, in-residence graduate students from all departments who have an interest in cybersecurity to take relevant courses from outside their home department, to reward students who pursue this approach with formal recognition, to generate a cross-campus community of interest featuring a speaker series and mentoring, and to provide financial support for cybersecurity-related research, conference attendance, and the like.",Disciplines: Technology,Strauss Center for International Security & Law,"Keywords: Cyber Fellows, Cyber Security, Cybersecurity, Strauss Center",Work Experience: Any,https://www.profellow.com/fellowship/cybersecurity-student-fellows-program/
Columbia HBCU Fellowship Program,Type: Masters Fellowships,"The Columbia HBCU Fellowship Program prepares talented, high-performing HBCU graduates to lead, innovate, drive community impact, and advance their professional industries through program engagement, mentorship, and career development opportunities. To be eligible, students must meet current HBCU seniors or recent graduates and apply to a School of Professional Studies full-time Master of Science program for the fall term.  Columbia HBCU Fellowship Program Benefits are Full tuition, On-campus housing, Community engagement and programming, Stipend, and Access to the global Columbia alumni network.","Disciplines: Medicine / Health Sciences, Science, Business, Engineering, Technology",Columbia University School of Professional Studies,"Keywords: Columbia, Columbia University, Full Funding, HBCU, HBCU Graduates, HBCU Senior, Recent graduate",Work Experience: Any,https://www.profellow.com/fellowship/columbia-hbcu-fellowship-program/
United States Digital Corps Fellowship,Type: Professional Fellowships,"The U.S. Digital Corps is a two‑year fellowship to launch your career at the intersection of technology and public service. The fellowship is a paid, full‑time position offering competitive salaries and benefits. Fellows will be able to convert to a full‑time career position upon successfully completing the program. The Digital Corps will support in‑person, hybrid, and distributed Fellows, subject to the telework policies of host agencies. The U.S. Digital Corps is an early‑career technology opportunity for recent graduates from qualifying associates, undergraduate, and graduate degree programs, reskilling, and other certificate programs. The five broad skill tracks are software engineering, data science and analytics, product management, design, and cybersecurity.","Disciplines: Public Service, Technology",United States Digital Corps,"Keywords: Cybersecurity, Data Analytics, Data Science, Early Career, Product Management, Public Service, Recent graduates, Software Engineering, Technology, Technology Opportunity",Work Experience: Any,https://www.profellow.com/fellowship/united-states-digital-corps-fellowship/
McCall MacBain Scholarships,Type: Masters Fellowships,"The McCall MacBain Scholarships are about much more than financial support. This program brings together a diverse group of scholars who aspire to lead with purpose – individuals who have demonstrated leadership potential and an inner drive to make a positive impact in other people’s lives. As a McCall MacBain Scholar, you’ll be able to pursue a fully funded master’s or second-entry professional undergraduate program at McGill University in Canada. The scholarship covers tuition and fees for the full normal duration of the master’s or professional program, a living stipend of $2,000 CAD per month during academic terms, and a relocation grant for moving to Montréal. The program is open to full-time students in all disciplines.","Disciplines: Education, Social Sciences / Liberal Arts, Medicine / Health Sciences, Science, Business, Creative Arts, Communications, Engineering, Public Service, Technology, Law, International Affairs",McGill University,"Keywords: Canada, Full Funding, Graduate Scholarships, Graduate Study, Master's Fellowships, McGill, McGill University",Work Experience: Any,https://www.profellow.com/fellowship/mccall-macbain-scholarships/
Kapor Fellows Venture Capital Program,"Type: Summer Fellowships, Professional Fellowships","The Kapor Fellows Venture Capital Program is designed to provide career pathways to exponentially accelerate the number of underrepresented individuals entering tech companies, venture capital, and tech-based entrepreneurship.  The cohort-based model connects individuals at various stages of their professional careers from various industries. This provides Fellows the opportunity to learn from one another as well as mentors. Fellows also have the opportunity to attend and participate in a variety of industry events throughout the summer. All Fellows are paid a living wage throughout the 10 weeks of the program. We also provide a computer and other tech equipment as needed.","Disciplines: Business, Technology",Kapor Center,"Keywords: Entrepreneurs, Entrepreneurship, Kapor Fellows, Professional Development, Startups, Technologist, Technology, Venture Capital",Work Experience: 0-5,https://www.profellow.com/fellowship/kapor-fellows-venture-capital-program/
oSTEM Scholarship Program,"Type: Masters Fellowships, Undergraduate Fellowships","Through the oSTEM Scholarship program, 15 scholarships are provided to the students who are attending community college, undergraduate, or graduate institutions to pursue a degree in a STEM field and must have completed at least one semester of higher education. The award amount is up to $5000. Applicants must identify as a member of the LGBTQ+ community. The general application can be used to apply to any (and multiple) of the scholarships that we offer. Applicants must be attending an institution based in a country where oSTEM has active chapters: the USA, United Kingdom, Canada, and Mexico.","Disciplines: Science, Engineering, Technology",oSTEM,"Keywords: Canada, Community College, LGBTQ, LGBTQ Community, LGBTQ Graduates, LGBTQ Undergraduates, Mexico, oSTEM Scholarship, STEM, STEM Fellowships, Undergraduate, United Kingdom, USA",Work Experience: Any,https://www.profellow.com/fellowship/ostem-scholarship-program/
Out to Innovate Scholarship,"Type: Masters Fellowships, Undergraduate Fellowships","The Out to Innovate Scholarships, established in 2011, are intended for LGBTQ+ undergraduate and graduate students pursuing degrees in science, technology, engineering, or mathematics (STEM) programs. The scholarships are designed to promote academic excellence and increased the visibility of talented LGBTQ+ students in STEM careers. The Scholarships program honor students who support a creative educational community that increases the visibility and the accomplishments of LGBTQ+ and supportive students and encourages students to be out in their careers and support diversity in the STEM workforce.","Disciplines: Science, Engineering, Technology",NOGLSTP,"Keywords: Engineering, Lesbian Scientists, LGBTQ, LGBTQ Students, Mathematics, Science, STEM, STEM Fellowships, Technology",Work Experience: Any,https://www.profellow.com/fellowship/noglstp-out-to-innovate-scholarship/
OGD Diversity and Community Fellows Program,Type: Masters Fellowships,"The Office for Graduate Diversity (OGD) is seeking Diversity and Community Fellows for the current academic year. Diversity and Community Fellows, individually and collectively, will advance and implement the Diversity and Inclusion goals of OGD and the Graduate Division. Critical components of this work will include but are not limited to, supporting an inclusive graduate community and enhancing the cultural, academic, and professional experience of historically underrepresented students (e.g., students of color, LGBTQ+ students, undocumented students, etc.). Diversity and Community Fellows will receive a stipend of $7,500 per academic year, paid at the start of each semester.","Disciplines: Education, Social Sciences / Liberal Arts, Medicine / Health Sciences, Science, Business, Creative Arts, Communications, Engineering, Public Service, Technology, Law, International Affairs",University of California Berkeley,"Keywords: First Generation College Students, Graduate Fellowships, Graduate Study, LGBTQ, LGBTQ Students, students of color, Underrepresented Students, undocumented students",Work Experience: Any,https://www.profellow.com/fellowship/ogd-diversity-and-community-fellows-program/
